{
  "legal_name": "Synthetic Kirana Demo",
  "trade_name": "Synthetic Kirana",
  "business_type": "retail",
  "address": "Synthetic demo address, Pune",
  "contact_email": "demo@example.com",
  "roles": [
    "buyer"
  ],
  "id": "20000000-0000-4000-8000-000000000001",
  "verification_status": "demo_verified",
  "membership_role": "owner",
  "created_at": "2026-10-31T10:00:00Z"
}
